{
  "contract_version": "2.1.0",
  "session": {"owner_identity_id": "owner:synthetic", "username": "synthetic-owner", "profile": "development_loopback", "absolute_expires_at": "2026-08-27T00:00:00+12:00"},
  "workspace": {"organization_id": "018f5c3e-7b00-7000-8000-000000001801", "workspace_id": "018f5c3e-7b00-7000-8000-000000001802", "display_name": "Synthetic contract workspace", "lifecycle_state": "ACTIVE", "lifecycle_version": 2},
  "document": {"document_id": "018f5c3e-7b00-7000-8000-000000001803", "workspace_id": "018f5c3e-7b00-7000-8000-000000001802", "active_version": 1, "prior_versions": [], "job_ids": ["018f5c3e-7b00-7000-8000-000000001804"], "media_type": "application/pdf", "size_bytes": 1024, "sha256": "sha256:aaaaaaaaaaaaaaaaaaaaaaaaaaaaaaaaaaaaaaaaaaaaaaaaaaaaaaaaaaaaaaaa", "admission_status": "accepted", "extraction_status": "partial_with_capability_gap", "capability_gaps": ["OCR_REQUIRED"]},
  "job": {"job_id": "018f5c3e-7b00-7000-8000-000000001804", "workspace_id": "018f5c3e-7b00-7000-8000-000000001802", "kind": "NATIVE_TEXT_EXTRACTION", "state": "succeeded", "attempt_count": 1, "lease_generation": 1, "idempotency_key": "synthetic:idempotent", "terminal_receipt": "receipt:synthetic"},
  "event": {"job_id": "018f5c3e-7b00-7000-8000-000000001804", "sequence": 1, "event_type": "job.succeeded", "terminal": true},
  "evidence": {"source_version_id": "018f5c3e-7b00-7000-8000-000000001805", "page_number": 1, "region": [0.0, 0.0, 1.0, 1.0], "evidence_digest": "sha256:bbbbbbbbbbbbbbbbbbbbbbbbbbbbbbbbbbbbbbbbbbbbbbbbbbbbbbbbbbbbbbbb", "authority_type": "workspace_source", "uncertainty": ["native_text_absent"], "quarantined": false},
  "mode": {"mode": "Restoration", "readiness": "FOUNDATION_ONLY", "missing_capabilities": ["DEDICATED_RESTORATION_WORKFLOW"], "gaps": ["WORK_REQUIREMENT_MATRIX_UNAVAILABLE"]},
  "knowledge_status": {"memory_data_defect": true, "verified_ntd_edition_count": 0, "rule_version_count": 0, "knowledge_ready": false, "blockers": ["MEMORY_DATA_DEFECT", "VERIFIED_NTD_UNAVAILABLE", "ACTIVE_RULE_VERSION_UNAVAILABLE"]},
  "error": {"code": "workspace_scope_denied", "correlation_id": "018f5c3e-7b00-7000-8000-000000001806"},
  "page": {"items": [], "next_cursor": null},
  "capability_status": {"slice": "PRODUCT-APPLICATION-SPINE-01", "implemented": ["application.http_api", "intake.streamed_upload"], "blockers": ["MEMORY_DATA_DEFECT", "SCALE_THRESHOLDS_UNSET"], "trial_ready": false, "oks_ready": false, "product_ready": false},
  "capability_readiness_delta": [
    {"capability_id": "interaction.frontend-shell", "prior": "NOT_IMPLEMENTED", "current": "CAPABILITY_READY", "evidence": ["browser-e2e.product-spine.owner-shell"]},
    {"capability_id": "interaction.workspace-selector", "prior": "NOT_IMPLEMENTED", "current": "CAPABILITY_READY", "evidence": ["browser-e2e.product-spine.workspace-a-b-reset"]},
    {"capability_id": "interaction.four-mode-navigation", "prior": "NOT_IMPLEMENTED", "current": "CAPABILITY_READY", "evidence": ["browser-e2e.product-spine.four-mode-shell"]},
    {"capability_id": "interaction.document-registry", "prior": "NOT_IMPLEMENTED", "current": "CAPABILITY_READY", "evidence": ["postgres-e2e.product-spine.document-registry"]},
    {"capability_id": "interaction.pdf-image-viewer", "prior": "NOT_IMPLEMENTED", "current": "PARTIAL", "evidence": ["viewer.locator-round-trip", "browser-e2e.product-spine.synthetic-pdf"]},
    {"capability_id": "interaction.evidence-side-panel", "prior": "NOT_IMPLEMENTED", "current": "PARTIAL", "evidence": ["postgres-e2e.product-spine.exact-locator"]},
    {"capability_id": "interaction.gaps-conflicts-blockers", "prior": "NOT_IMPLEMENTED", "current": "CAPABILITY_READY", "evidence": ["browser-e2e.product-spine.honest-knowledge-blockers"]},
    {"capability_id": "interaction.job-progress-recovery", "prior": "NOT_IMPLEMENTED", "current": "PARTIAL", "evidence": ["browser-e2e.product-spine.job-progress", "postgres-scale.worker-restart"]},
    {"capability_id": "application.http-api", "prior": "CONTRACT_ONLY", "current": "CAPABILITY_READY", "evidence": ["openapi.product-spine-v1", "postgres-e2e.product-spine"]},
    {"capability_id": "application.authentication", "prior": "CONTRACT_ONLY", "current": "CAPABILITY_READY", "evidence": ["postgres-e2e.product-spine.session-csrf"]},
    {"capability_id": "application.session-handling", "prior": "CONTRACT_ONLY", "current": "CAPABILITY_READY", "evidence": ["postgres-e2e.product-spine.session-csrf"]},
    {"capability_id": "application.durable-job-orchestration", "prior": "NOT_IMPLEMENTED", "current": "CAPABILITY_READY", "evidence": ["postgres-e2e.product-spine.durable-jobs", "postgres-scale.worker-restart"]},
    {"capability_id": "application.progress-events", "prior": "NOT_IMPLEMENTED", "current": "PARTIAL", "evidence": ["browser-e2e.product-spine.sse-contract"]},
    {"capability_id": "application.job-control", "prior": "NOT_IMPLEMENTED", "current": "PARTIAL", "evidence": ["unit.product-spine.cancellation-fencing"]},
    {"capability_id": "intake.batch-upload", "prior": "CONTRACT_ONLY", "current": "CAPABILITY_READY", "evidence": ["postgres-e2e.product-spine.batch-upload"]},
    {"capability_id": "intake.streamed-hashing", "prior": "FOUNDATION_ONLY", "current": "CAPABILITY_READY", "evidence": ["postgres-e2e.product-spine.digest"]},
    {"capability_id": "intake.mime-content-validation", "prior": "FOUNDATION_ONLY", "current": "CAPABILITY_READY", "evidence": ["unit.product-spine.mime-path"]},
    {"capability_id": "intake.deduplication", "prior": "FOUNDATION_ONLY", "current": "CAPABILITY_READY", "evidence": ["unit.product-spine.idempotency"]},
    {"capability_id": "intake.pdf-page-inventory", "prior": "FOUNDATION_ONLY", "current": "CAPABILITY_READY", "evidence": ["postgres-e2e.product-spine.pdf-inventory"]},
    {"capability_id": "intake.native-extraction", "prior": "FOUNDATION_ONLY", "current": "PARTIAL", "evidence": ["postgres-e2e.product-spine.native-first-gap"]},
    {"capability_id": "intake.crash-recovery", "prior": "CONTRACT_ONLY", "current": "CAPABILITY_READY", "evidence": ["postgres-scale.worker-restart", "unit.product-spine.lease-recovery"]},
    {"capability_id": "intake.scale-1k", "prior": "NOT_IMPLEMENTED", "current": "PARTIAL", "evidence": ["scale.synthetic-content-minimal-1000"]},
    {"capability_id": "intake.scale-5k", "prior": "NOT_IMPLEMENTED", "current": "PARTIAL", "evidence": ["scale.synthetic-content-minimal-5000"]},
    {"capability_id": "intake.scale-10k", "prior": "NOT_IMPLEMENTED", "current": "PARTIAL", "evidence": ["scale.synthetic-content-minimal-10000"]},
    {"capability_id": "operations.document-worker", "prior": "CONTRACT_ONLY", "current": "CAPABILITY_READY", "evidence": ["postgres-e2e.product-spine.worker", "postgres-scale.worker-restart"]}
  ],
  "scale_qualification_results": [
    {"profile": "synthetic-content-minimal-1000", "accepted": 1000, "rejected": 0, "jobs": 5000, "lost_jobs": 0, "threshold_status": "UNSET_MEASURED_ONLY"},
    {"profile": "synthetic-content-minimal-5000", "accepted": 5000, "rejected": 0, "jobs": 25000, "lost_jobs": 0, "threshold_status": "UNSET_MEASURED_ONLY"},
    {"profile": "synthetic-content-minimal-10000", "accepted": 10000, "rejected": 0, "jobs": 50000, "lost_jobs": 0, "threshold_status": "UNSET_MEASURED_ONLY"}
  ],
  "effective_registry_readiness": {"denominator": 142, "NOT_IMPLEMENTED": 7, "CONTRACT_ONLY": 64, "FOUNDATION_ONLY": 45, "PARTIAL": 10, "CAPABILITY_READY": 16, "MODE_READY": 0, "TRIAL_READY": 0, "PRODUCT_READY": 0}
}
